916. Poseidon Bungalows & Surin Tours," 3,749",211,in the forest just a few feet having spectacular views while being in the shade and therefore cooler allowing you to sleep in a little. Wonderful beach front…
917. Yaks House," 2,673",65,"was wondrful with our daughters.
The place is clean, well-designed,  big kitchen, washing-machine and drier.
They have a nice little restaurant with great food.
Good..."
918. Monoceros Resort," 4,436",73,"made us feel so welcome, very warm and friendly people. super relaxed atmosphere.Just relaxing at the pool or in the hammock is also a very good way to spent your..."
919. P21 Chiang Mai," 2,271",165,"night, we checked in early. As expected, room was not ready so we left our luggages with the concierge. Came back really late into the night and realised that they…"
920. Le Canal Boutique house," 2,871",122,There are small cafe and tourists attractions nearby. The receptionists are so polite and welcoming. Comfortable room and equipment available. Quiet and peaceful...
921. The Ghee House," 2,066",74,"while in Thailand for our honeymoon. The staff was great from checkin to checkout. 

We had a private room on the 3rd floor. The shared bath was nice and always had..."
922. Marisa Resort And Spa," 3,476",176,on the lake.
923. J.B Hut Bungalow," 1,745",167,"the sea...nice pool too...every room has a balcony and hammock, really nice...super friendly staff too...limited menu in the restaurant but tasty enough and fair..."
924. Aonang Hill @ 11/1," 5,637",141,"February 2023. It is well located in Ao Nang town, close to the main restaurants, supermarkets and atractions of the city center. It is not right in the city center, but..."
925. Watercolours," 3,454",65,"which is right on the river and a short walk to the beach. Free Kayaks, canoes and SUP's are supplied and what a cool paddle it was. Eric the owner is great with..."
926. Sukhothai Garden," 3,476",92,"several options that I enjoyed. The hotel provides bikes that you can ride around the biggest historical sites, which are right up the street. Many restaurants withing..."
927. Siboya Bungalows," 1,444",86,"reasonable price and a very relaxed and laid back atmosphere.
The many long term guests welcomed us with open arms and made us feel like family .
By far the most..."
928. Cat Story Hotel," 3,143",111,"cats. The hotel is newly renovated, the rooms are nice and trendy with comfy beds. All the staff are extremely welcoming. Very close to the main markets and Patong..."
929. FUN-D Hostel," 1,453",172,"and friendly. Our kids were in heaven to have a playroom with some toys, games, TV, tent, keyboard, etc. Then over the moon to have Disney channel turned on for them…"
930. Lemonade Boutique Inn," 1,697",117,"lucky to book here. From check in to check out everything was superb at incredible value. Comfortable, clean & so convenient, beach is a 2min stroll away, 7-11..."
931. Sara Beachfront Boutique Resort," 15,195",125,Gorgeous teak floors and furniture. Comfortable beds. Infinity pool is large. Pizza was delicious highly recommend staying here. You can take a long stroll down a…
932. Namaka Resort Kamala," 8,295",151,
933. Jomtien Hostel Hotel," 1,123",160,"beach and the main road. First and foremost, rooms are very spacious and clean. They all have a balcony. There is even an elevator, which is very convenient as…"
934. Cozy Inn Chiang Mai," 1,491",142,"... strategic area, closed to Nong Buak Haad public park, surrounding by flowers park ... The"
935. OYO 75344 Ban Elephant Blanc Apartment," 1,965",109,"the business of kata. Pascal and philip make great hoasts, very friendly, kind and helpful. The breakfast was to die for, all home made, right down to the jam. It was..."
936. Rapeepan Ville Hotel," 9,073",86,"hotel is beautiful in design and very well maintained. The staff were very friendly and engaging and helpful.

Food in the restaurant was delicious.

Our room was..."
937. Lotus Friendly Hotel," 2,906",254,
938. Nonze Hostel," 6,959",105,"hostel i ll recommend to everyone and the best part is room Service please vist there once and if u r in pattaya this ll be ur best experience, beach in front of ur…"
939. Bangbao Beach Resort," 3,638",130,Having arrived at the resort we were even
940. Green Park Resort," 5,554",792,overlooking the garden and pool open from day one.
941. Light Khao Lak Resort," 3,691",108,and to all the staff. We fully enjoyed coming back to your hotel every evening after a beautiful day in one of the many beaches of Khao Lak. A special thanks to Nid...
942. The Lai Thai," 4,117",89,"staff. clean rooms, good wifi and very comfy beds.   good location away from the crowds but close enough to all the restaurants and bars and the beach.  place was quiet."
943. Everest Resort Samui - 150m beach," 2,791",71,"here. There is a gym 5 minutes away and great restaurants and good stores on this street, and the beach. ALL within 5 minutes. Its very quiet here. The people who…"
944. Lanta Happy Hill Resort," 2,955",85,street from a nice little beach with cute beach bars. We stayed 5 nights and rented a scooter from the hotel at a reasonable price. Our room was clean and spacious...
945. Baan Sang Singh," 2,966",120,stayed in many places in the city over the last 8 years and this is my new favourite.  From you arriving the staff are all friendly and helpful.  The room (corner...
946. Phukalini Luxury Pool Villa & Onsen," 12,057",30,"in.  Went with my wife and three other close friends to stay in one of their 3-bedroom villas.   The location is wonderful, about 12-15 minutes from the markets..."
947. Chayadol Resort," 3,629",178,"not to stay at our usual hotel as wanted a swimming pool this trip. It is not too far from the clock tower, about 3km and the route is easy to learn. The rooms are..."
948. iCheck Inn Residences Sathorn," 3,927",213,"staff were fine.We booked the room because it had a balcony but all of the balconies in the hotel were locked so nobody could use theirs.Also no restaurant,not even…"
"949. Kantary House, Bangkok"," 5,991",205,airport yet still convenient to travel to the centre. Room is abit dated but the room is spacious and the bed is comfortable. Quiet good for our jetlag sleeps. I wish I...
950. Leelawadee Garden Resort," 5,056",96,"stay for three weeks, but this gem of a quiet,  clean and beautiful place , kept us there for all of our 5 weeks holiday, The owners , Paul and Bo are the best…"
951. S.K. House 2," 1,771",492,"location, it is easy to walk from there to eat and see the city. There is a fine swimming pool and comfortable lobby. One od the mail temples is on the next street."
952. At Pingnakorn Hotel Chiangmai," 4,663",273,"affordable. The hotel is beautiful and gives you that cozy feeling. It is next to a river and many great photo opportunities! 
We stayed in the suite for a night, and we..."
953. The Title Condo By Tropiclook," 4,154",201,"restaurants, massage parlour, convenient stores and few mins to Naiharn beach. Stayed in The Title Beach Front Hotel with special instructions.  Security is tight..."
954. Groovy Bungalows," 3,137",89,"fantastic aircon, rooms cleaned daily, towels changed alt days. Breakfast was self service but G cooks eggs and pancakes of requested. Choice of ceral, fruit toast…"
955. Krabi Apartment Hotel," 7,053",110,"accommodations. Eve at the desk was especially helpful. Flowers for Valentines, 
A cake for my friend's birthday .Lots of extra care taken. I will  return."
956. Donchaihouse," 1,424",65,"for the price. 15 mins from the city center, but you should not be discouraged. You have everything you need with this place. Scooter rental, taxi, tour, massage..."
957. Lom La Lanta," 4,366",103,"in February 2020 -- I ended up staying three nights longer than planned because I loved it so much. Sada's place is very sweet, close to all sorts of amenities..."
958. 168 Chiangmai Guesthouse," 1,902",87,"stay in the old city. Everyone is super friendly, the accommodation is clean, surveillance cameras keep it safe, you get a locker, location is great, and I…"
959. The Theatre Villa," 2,757",110,"Phuket and decided to stay the night at The theatre villa. When we arrived, a bit late, but were warmly welcomed.
The food was excellent, as was the breakfast with..."
960. Baan Phu Prana Boutique Villa," 146,863",101,"beautiful and well appointed with a stunning pool.The staff looked after us and the food cooked by both Chefs was varied and delicious. Gale, the villa manager was..."
991. Simple Life Cliff View Resort," 6,460",168,We are staying at this beautiful location currently having an amazing holiday We
992. The Journey Hotel," 2,438",82,experience with AGODA that ruined our trust and confidence with them. We had booked through them for our 3 nights stay at Bahi Ajman Palace Hotel - one month in advance and…
993. Jungle Hill Bungalow," 5,517",192,"net. We had superior bungalow with partial sea view. Staff kind, friendly and very helpful..We know there would be many steps, they are quire steep and a bit of a..."
994. Mai Pen Rai Bungalows," 1,915",427,"race this could be the place for you, but it’s basic as that’s part of its appeal. We had a beach bungalow and got up to see the dawn at 5,30 it was beautiful. The..."
995. Thai Island Dream Estate," 10,637",126,"private pool, sun beds and a nice garden and seating area under a gazebo.  The location is fantastic and really would be hard to beat, however there are a few things to…"
996. Arnoma Grand Bangkok," 7,859",877,conditioning works this time.
997. Fifth Jomtien Pattaya," 4,708",215,
998. Siam Lanta Resort," 1,965",64,"outstanding feature was the couple running the resort, nothing was too much trouble."
999. Sherloft Home and Hostel," 3,642",45,"received by the host, who also gave us a good advice on where to find street food nearby. The place is charming and well located (center of the city), which is very..."
1000. Jasmine Hills Lodge," 4,842",109,
1001. Peach Blossom Resort," 4,534",346,Couple times in the week very Good idea.. and the 2 chefs are very polite chef Anmol and Toshu  åt peach Blossom  hotell kindful  very quiet area up in the Hill Mr…
1002. Matchbox Bangkok Hostel," 1,997",139,"changed or they had bad luck. Air-con was on with me at all times. 

There is a common area, but yeah there’s mostly local people or other Asians and not much..."
1003. Orchid Resortel," 3,452",122,standard room an under-the-table fridge.
1004. Pinghostel," 3,383",39,"clean and looks very nice and pleasing. I think this is newly  built. Staff are so kind and accommodating. Place is close to temples, massage spas, stores, restos..."
1005. WE Terminal Hotel," 2,929",118,rooms but done out to a high quality really comfy beds close to the airport staff were really friendly. tiny pool on roof this place has used every ounce of space but...
1006. Baan U Sabai Boutique House," 3,451",124,convenient for the airport. A tiny bit old fashioned but very clean and the staff were friendly and helpful. Very charming 'old world' style. Noise insulation isn't...
1007. Baan Penny," 2,687",41,
1008. Dhevi Bangkok Hotel," 5,237",33,
"1009. Classic Kameo Hotel & Serviced Apartments, Rayong"," 6,186",145,but not too firm so for me it was good sleeping quality. Big breakfast area and was great with all kind of food and fresh fruits. Big parking area. Hotel provided...
1010. Pattana Sports Resort," 8,318",76,perfect swimming pool.
1011. Gecko Hotel," 2,474",66,"when I arrived I realized that I could not choose better. Unique reception. The owner is a true Italian gentleman. The hotel and the rooms are new, totally..."
1012. Hueandin Klinmai Boutique Hotel," 1,872",48,"Actually we felt like home. The Landlady, Toy is such a wonderful hostess, she got very good vibes. If we ever come back to Chiang Mai, we will stay on Toy’s Boutique..."
1013. O'nya Phuket Hotel," 2,583",131,decor is charming. Our room was both comfortable and clean. There was lots of cupboard space and the suitcase rack was big enough to accommodate two suitcases. The...
1014. Sivalai Place," 4,334",178,"visited to Bangkok, Thailand.
Situated in quite residential area of Bangkok old city. Easy access to all areas. Room is very clean and wide enough. Reasonable price…"
1015. iCheck Inn Nana," 3,812",351,"Sukhumvit Road for night life, shopping and access to freeway out of Bangkok to airport. Clean, comfortable, small modern hotel. Minor criticism, have to walk up soi…"
1016. I-River Chiangmai," 3,354",89,"tuk into old town. 
Rooms were small and there was noise from the street but overall was fine. 
Breakfast often cold but did it’s job, free water all the time..."
1017. Krabi Nemo House," 6,681",114,we booked for 4 nights but ended up staying for a whole week! Lovely lady running the place. It is a a little far from the beach but they give free ride to the…
1018. Canaan Guesthouse," 1,051",140,"the room was small, it was very comfortable with a well functioning bathroom.  The staff was very nice and helpful when necessary.   The wifi functioned reliable..."
1019. Bee Friend Hostel," 2,058",44,nice and clear. The breakfast is amazing and was prepared individually. The Hotel owner was very friendly and helped us a lot concerning trips and just everything we...
1020. Chiang Mai Summer Resort," 1,513",75,"over-attentive staff :).  This place took great care of the basics - daily cleaning, prompt laundry service (included!), etc.  the kitchens are clean and very well-stocked..."
1021. Jirana Hotel Patong," 102,172",57,"The room is spacious, clean and most impressive of all, a superb hilltop view overlooking Patong beach. The service provided by their stall and most important of…"
1022. Hotel Once Bangkok," 20,447",206,We felt really relaxed and spent the whole
1023. Riverfront Hotel Mukdahan," 2,719",138,"balcony overlooking the river, one double bed and one single bed, fridge, kettle, desk, TV with many channels (no English channels), and beautiful wooden furniture."
1024. Cinnamon Beach Villas," 4,326",168,"A little away from the hustle and bustle of central Koh Samui, Cinnamon Beach Villa Resort is a perfect place if you like to stay in a quiet place and around lots of"
1025. AYA Boutique Pattaya Hotel," 9,453",560,
1026. Bhundhari Chaweng Beach Resort," 4,478",304,airport pick-up despite reminders. We were made to wait for some time till it was confirmed that no pick-up was arranged. Took another taxi from the airport desk and...
1027. The Old Palace Resort," 2,467",240,friendly and helpful. The breakfast was correct and the rooms were a little bit small but well-cleaned. You can rent bycicle for 50b per person and day. Nice and good spot
1028. Hilltop Wellness Resort," 6,683",35,"Everything was perfect, incredible"
1029. Moonhut Bungalows," 1,839",347,"to K Phangang, Angela’s at Moonhut is a well kept secret.  Great ranging menu with Ruben Sandwich, Cob Salad, Seafood Saghetti and the normal range of Thai food..."
1030. MovyLodge Hostel," 3,068",71,"lift. Room of 6 is located at 4th floor. Location is good, 6mins walk to BTS station. Bed is comfortable. Washroom is clean.

Pls also note there is no vibe for..."
1031. Si Phum Heritage Boutique Bed & Breakfast," 1,258",92,shower was a big room. the hotel is just across from the old city and despite being in a back street feels absolutely safe and secure. Only down side was that I was on…
1032. The Spa Resorts," 8,245",226,The facilities are excellent
1033. Baan Nampetch Hostel," 1,891",154,near the centre of Bangkok and Koh Sam road. But feels very quiet and peaceful- perfect if you’re looking to chill out and not party for a few nights. The terrace is...
1034. Haad Salad Villa," 4,163",203,were nicer than expected even with air-conditioning. The terasse with the hammock was great to chill also on a rainy day or in the evening. Loved it! However the Beach...
1035. Smith Residence," 1,936",183,was great as usual. The staff were polite the cafe put out good food at a reasonable price and my room was a good value. Chiang Mai is quiet  now due to the CoVid...
1036. Guesthouse Canary," 1,318",84,"location is just outside the main drag so you will not hear all the music and parties, but you can walk there in 5 minutes.
Cross the river.
So you have a lovely…"
1037. At Kamala Hotel," 3,516",65,"large bed, small wardrobe with a safe box, fridge, kettle, tiny TV (but with a very good selection of channels), wet style bathroom, and a small balcony with a table..."
1038. Karon Butterfly Residence," 5,476",96,"years now, the management and maintenance is perfectly managed Hassen the manager manages this condo like his own house the employees are very attentive (swimming…"
1039. Home Phang Nga Guesthouse," 2,197",63,on a pleasant residential street.  The people who own and operate the guest house are very pleasant and helpful.  Highly recommended place to stay in Phang Na.
1040. Sugar Ohana Poshtel," 4,498",46,"boutique-styled accommodation. The owner takes a personal interest in all guests and is very friendly and ready for a chat. From the beginning,all the staff are so hospitable..."
1041. Lada Krabi Residence," 2,590",239,
1042. Malee's Nature Lovers Bungalows," 2,000",195,"kids 5 and 8 years old. We were welcomed as family, Malee and her husband and brother were so nice! The place is beautiful with all kind of flowers and a big…"
1043. Mountain View Guest House," 3,415",209,"in my two weeks visit. 
friendly staff, fridge with beer at the reception, big bathroom and overall very clean. 
Aldo there is the parking lot for the moped that is…"
1044. Papangkorn House," 1,773",82,You
1045. Grandmom Place," 1,627",78,"The room is a good size, good location and good value!  There’s loads of bars & restaurants around and nice and close to the river, where you’ll find the night..."
1046. First Choice Suites by the Sea," 2,334",102,"hotel: this is a service apartment. Here, no lobby to welcome you but a juristic office. It was a bit long to obtain the keys of the room. However, the room rent was…"
1047. Buddy Boutique Inn," 2,490",337,"the staff is friendly, the rooms are quite large and clean, the location not far from Kao San road is good for sightseeing and for going out in the evening. Another..."
1048. Baan Andaman Hotel Bed & Breakfast, 891,321,"part of Krabi town, it is not far if you love walking. There is a shuttle which runs until 7pm (to town) and returns at 8pm (from town). The shuttle service should be..."
1049. Refill Now!," 2,526",132,"& opera playing in the background, as well as very relaxed seating area. The pool is small but still have to rate this place 5/5 because of how gorgeous and green..."
1050. Ban Chang Tong," 3,834",139,bed and nice pillows.
1051. Khao Sok Cabana Resort," 3,396",101,"visit to Khao Sok National Park, and found it lovely, set amidst greenery and right next to the Klong Sok River. The cabanas are equipped with aircon but I opted for…"
1052. Bamboo Bungalows," 3,125",230,is situated in the middle of Long Beach. The staff is very friendly and helpful. it has one of the better restaurants for the value on the beach and the food is very...
1053. Vela Dhi Udon Thani," 6,048",43,homemade bread and pastry and local food too.
1054. Rancho Charnvee Resort & Country Club," 17,105",60,"khaoyai. It was a wonderful experience. At the cafe have many activity to do riding a horse, riding classic car etc. I choose riding classic car .. K.Hongtae staff of…"
1055. Eco Valley Lodge Khao Yai," 15,510",105,touring Khao Yai National Park. We arrived by van to Pak Chong and the manager James was very helpful in arranging a smooth pickup and transport to the lodge. We had...
1056. The Blue Sky Resort - Khao Kho," 8,267",151,"Very wet arrival, but the staff"
1057. The Aiyapura Koh Chang," 9,281",390,grounds. This place is peaceful and very lovely. I had a very relaxing 5 days here. I had a premier deluxe bungalow with a view to the sea which was very spacious. A...
1058. Khao Sok Palm Garden Resort," 2,919",75,"peaceful surroundings - a very helpful owner and his wife -- fridge, hair dryer, kettle, towels, soap and shampoo in the room - probably there is a „price fixing…"
1059. Lala Mukha Tented Resort Khao Yai," 10,881",150,"place was so organize and beautiful. The tent that we stayed doesn’t include a bathroom. We used the shared bathroom, they do have both indoor & outdoor shower..."
1060. Oscar Villa," 2,697",149,"clean, nice and close to the pool. However I must say that the bathroom had a bad smell when we arrived (odour went away on the second day). Owners are nice and..."
1061. Coconut Homes," 8,893",52,"it’s always nice for us to take a weekend off and stay with friends at the quiet Coconut Homes. Rain doesn’t matter, we always enjoy the friendship and guest we meet..."
1062. Lavana Hotel Chiangmai," 4,875",41,"Rooms are big and clean. The bed was super comfortable as well as the pillows. 
The wifi is FAST and stable. 
Breakfast and coffee were included and the food was…"
1063. LaRio Hotel Krabi," 3,481",54,second time I stayed in this hotel. I have a room in 3 styles of this hotel. But my favorite is probably the Duplex Studio Room. This room has good privacy. I like the...
1064. Fulfill Phuket Hostel," 2,207",98,"bathroom, the room is a bit small but big enough for us. Breakfast was included in the price of the room, however it was fairly basic toast and cereal. There were lots of..."
1065. Woodlands Suites Serviced Residences," 8,841",89,"!) and really is a very good hotel to live. I feel so nice and they made that I didn´t miss my family too much...ja !
The breakfast is great and hotel staff is..."
1066. The Bedrooms Boutique Hotel," 3,295",261,"mall, markets and street food places. Big C and Tesco just around.
Near from main road but in a side dead end just for this hotel and 2 massage shops, it is not..."
1067. Tri Gong Residence," 1,563",257,"First of all it is a good location, fairly quite area but only minutes walk to to everything you need. The rooms are a little dated but confortable. Everything..."
1068. Thai Siam Residence," 2,213",157,
1069. Nakaraj Princess Chiangrai B&B," 4,765",75,from Chiang Mai. Hotel is near the Night Bazaar and very close to the Saturday night pedestrian street night market. Rooms were huge. Bed was good but hot water…
1070. Pai Nam Now Guesthouse," 1,988",56,"best bed and bedding, So comfortable."
1071. Andaman Pearl Resort," 2,689",156,"real pleasure. Very nice hotel with great mountain views and warm, friendly and helpful staff.
I would not say that hotel location is very far from city and beach..."
1072. Budchui Village 2," 2,973",56,"was perfect! The staff were so unbelievably helpful and kind, they made our stay so enjoyable. It’s a great location, close to the main streets, the pool and rooms..."
1073. Baan Ratchiangsaen," 3,125",141,"under 10 mins away. The street is quiet but actually has two bakeries, a bar and small food shops. This side of the city seemed a bit quieter which we didn’t mind..."
1074. Baan Nan Hotel," 3,132",65,
1075. Blu Monkey Bed & Breakfast Phuket," 2,711",163,"Phuket. Unfortunately the external bookingsite booked us in another Blu Monkey, about 200 km north. As is was non-refundable we contacted Blu Monkey directly. The..."
1076. Apo Hotel," 2,437",168,"con, fridge, kettle (free coffee/tea), 2 bottles of water, hairdryer and a hot, powerful shower. The rooms are spread over 2 buildings  with the reception being in..."
1077. Le Versace Residence," 2,586",78,"watch sunset from the bed !!
Friendly staff and good furniture!!
Have some step but is good!!! Healthy)))
Quiet place with the best view!!! I will go back sure !!!"
1078. Space Ben Guesthouse @Muangkao," 1,963",49,we didn’t plan on. We booked it last minute and are so happy we did. The hostess was very welcoming and accommodating. It’s located so close to the historical park...
1079. De Wiangkumkam Hotel," 3,280",85,"?????????????????????????????????????????????? ???????????????????????????????????????? ???????????? ????????????????? ????????, ?????????????????????????????..."
1080. Chan Chiangmai House," 3,406",49,"here 26 to 29 December. The rooms were spacious and clean, complimentary coffee is available at reception and the hotel is very well situated to explore Chiang Mai..."
1081. P.P. Blue Sky Resort," 13,267",240,"stunning!!

The accommodation is ok..
a/c
Towels
Clean sheets 
Staff very kind 

I think long beach is the best on Phi Phi.. a little bit of a tropical island"
"1082. Margarita Beach (Bar, Grill, Shacks)"," 6,537",112,the service was really good!
1083. Rain Tree Residence," 13,484",44,was the best hotel we have stayed in. It's just a beautiful property with so much space and greenery to it. The staff we fabulous and so helpful every one of them...
1084. Chiangrai Green Park Resort," 1,850",87,"furnishings. Very spacious rooms. Bathroom was clean and big. 

They provided kettle and mugs however no tea/coffee or spoons. 
Water was provided in the rooms..."
1085. Hide Bangkok Hostel," 2,054",52,organised our taxi and answered our questions. The room was older looking than photos online and white small but air con worked very well and bed was comfy. Area was good…
1086. March Hotel," 2,379",169,bathroom equipt with good shower and toiletries.
1087. David Residence," 4,528",116,"Although you can walk from the terminal,suggest you utilize the free round free shuttle service provided by the hotel ( 24"
1088. Bluerama Koh Phangan," 10,092",265,I was fortunate
1089. Flipper House Hotel," 3,577",422,"with hot water, tea and coffee making in the room."
