361. InterContinental Residence Suites Dubai F.C," 13,691",788,"My stay was made that little bit more special by the house keeping team Erika and Abilash, who always made sure"
362. Radisson Red Dubai Silicon Oasis," 14,704","1,095","excellent staff, actually girls from reception Mara and Meggy , they are so polite Thank you for great service!!!"
363. Al Khoory Inn," 6,875",197,It was amazing when entering in the hotel the staff at the reception was
364. Savoy Suites Hotel Apartment," 5,747",804,Very nice service awesome friendly staff special Prakash
365. Avani Ibn Battuta Dubai Hotel," 7,557",860,Wonderful experience with housekeeping team especially Santosh thank you for making my stay amazing I got everyday room
366. Millennium Airport Hotel Dubai," 11,283","3,017","special mention to the staff of the breakfast area - And special thanks to Kamel Hussaini, very helpful and friendly, who kindly watched my stuff behind the room’s doo..."
367. Fortune Park Hotel," 7,472",64,looking for a comfortable option  Rooms were big and clean. Food was good as well at dinner and breakfast. Staff was very friendly. Negative: it is outside of town and...
368. Fortune Pearl Hotel," 3,453",271,"I came fortune pearl hotel ,excellent staff more welcome I like to stay here because very good access, great service staffs with excellent hospitality,good"
369. Landmark Plaza Hotel," 3,518",225,very good.located
370. Avenue Hotel," 9,026",305,Made for a fantastic holiday trip as I always came back very made
371. Raviz Center Point Hotel," 6,010",358,"trip to dubai and this was the  property shortlisted with the travel agent.

Location  - This is in a prime location. Not so far from major attractions. Metro..."
372. Holiday International Hotel Embassy District," 4,698","1,040","next morning at their All Day dining restaurant - ANWAR Restaurant, which is a huge restaurant serving an international variety of dishes for breakfast."
373. Sun and Sands Sea View Hotel," 4,096",206,money and the rooms are clean and neat. The location is good and we loved the fact that there were lots of restaurants on the same street. There was a bit of...
374. Coral Dubai Deira Hotel," 6,313","1,073","it was very good stay with coral dubai deira hotel, the reception staff are excellent and helpful Oslo housekeeping staff very good service,"
375. Best Western Plus Pearl Creek," 6,039",783,Amazing hotel best western plus pearl
376. Admiral Plaza Hotel," 8,878",508,room to be larger at least with a separate sitting area. It was just a regular size room and didn't look like the pictures. It was obvious those were taken a long...
377. IntercityHotel Dubai Jaddaf Waterfront," 5,605",76,Great hotel clean place amazing canal view Thank you to front office staff for quick checkin and transport
378. Panorama Hotel Bur Dubai," 4,257",166,"other services are poor, for example i had to return the room dining food it was not eatable the bread is old and the french toast was burned, also the operator…"
379. TIME Grand Plaza Hotel," 5,718","1,322",Excellent
380. Zagy Hotel," 5,595",17,day or 2 and are on a budget. The hotel is very clean and very well kept. The ACs work well and you will get 24 hour running hot water. The staff is very helpful…
381. Al Sarab Hotel," 4,185",95,
382. Fortune Atrium Hotel," 6,338",12,"rooms.
The equipe is very kind Muzaffar & Kamala 
Swimming pool and gym is nice and they also include sauna that you can use when you want 
Every day rooms are..."
383. White Fort Hotel," 4,397",55,"the Anantara.  My flight from Dubai was at midnight, therefore it was pointless paying for an extra night if I was not going to stay the night.

I chose this…"
384. Mount Royal Hotel," 3,590",42,"into this hotel try 2nd and 3rdfloors .. There breakfast is fine, the TV is old not LED pr Lcd Tv! the cable channels is not good for Western Travelers as they only..."
385. Unlock J One," 13,867",4,It was lovely stay in one bedroom with canal
386. OYO 393 Al Wehda Hotel," 3,746",5,"Choose apartment if bring family, not Hotel.. Large room, perfect location, but price little bit more. Breakfast standart compare hotel in abudhabi.. Enjoy with jacuzzi."
387. Mercure Dubai Barsha Heights Hotel Suites," 13,325",5,"the space and great location, with a Metro station right outside. There are a couple fo bars and restaurants and a lobby cafe, plus a handy grocery shop downstairs..."
388. Nine Hotel," 4,673",3,"room was full of flies, the television was old, the bathroom also has very old equipments, the cleanliness was zero, as I saw mucus on the bathroom door."
389. Lavender Hotel And Hotel Apartments," 6,100",12,
390. Oaks Liwa Heights," 261,859",330,We love the facilities and have
391. Pullman Dubai Creek City Centre Residences," 33,271","1,001",... the Executive lounge and restaurant have variety and My recommendation goes to this two Mr. Sunil Kumar and Mr. Wajira from house keeping  they were spot on and
392. SLS Dubai Hotel & Residences," 40,486",927,In short when you reserve a room you
393. DAMAC Towers by Paramount Hotels & Resorts," 40,600",255,"hotel has a beautiful, luxury reception and lobby. it is a new and clean hotel, but the bathroom soap holder and towels in our room were old. Even the shampoo and..."
394. Roda Al Murooj Residences," 44,317",28,"residences) and got to be part of 31st Dec festivities

Ok so first all the good stuff
- Location is just fantastic if Burj, Mall and other attractions is your..."
395. Sonder Downtown Towers," 33,335",137,We booked
396. Radiance Premium Suites," 14,310",514,My room
397. Vida Dubai Marina & Yacht Club," 24,661",83,"as well. I will check this place out again for my next travel , i was very happy with the service staff and resort , very nice and inviting , amazing views"
398. Flora Creek Deluxe Hotel Apartments," 8,979","1,988","The house keeping staff did an excellent job and special word of appreciation for Anandu, who worked tirelessly to make sure that I was provided"
399. Hampton by Hilton Dubai Al Seef," 9,615",453,"breakfast friendly staff, in the evening you can walk along the promenade great variety especially if you are with children there is a pool, not big but just right for c..."
400. Aloft Me'aisam Dubai," 6,667",235,working well.
401. Vida Residences Downtown," 29,842",16,Kitchen and an island where the we would comforfortably sit and have breakfast.
402. Savoy Crest Hotel Apartments," 8,559",760,It was good experience all staff are
403. Al Jawhara Gardens Hotel," 8,865",310,excellent Everything is great The reception is great The cleanliness is excellent The place
404. Chelsea Gardens Hotel Apartments," 5,445",460,The room is awesome and also room service is so nice keeping the room need and tidy gurjit will come regularly
405. Comfort Inn Hotel Dubai," 3,596",400,my wife and 5 year ols child.Attentive staff. They gave us additional bed for chond. I can give even more then 3 stars.   Satisfying breakfast and lunch…
406. Lavender Hotel Dubai," 6,099",218,"reasonable price, nice bathroom and good location which was close to lots of supermarkets and malls. Except awful breakfast that other  had also mentioned, everything..."
407. Le Wana Hotel," 5,165",23,near to the metro station and Al Ghurair mall and there are many shops and restaurants that are opened till late night. We stayed for 6 nights and the breakfast was...
408. Fortune Karama Hotel," 5,021",200,The price
409. Ramee Rose Hotel," 4,034",584,Their Team leader Vikram and House keeping staff
410. Sun and Sands Hotel," 3,520",228,"room card on time, maybe 5 minute later.
The room was clean. but didn't the same as the image we saw on the sites. room 618

We chose this hotel for 2 reason. save..."
411. Saffron Boutique Hotel," 3,341",114,"good thing the room was clean and spacious although the bathroom was very small. Not much noise was experienced during the stay, the bellman was very helpful..."
412. Dolphin Hotel Apartments," 5,061",104,prime location and room was very comfortable. Good value for money! The facilities are on par with a star category hotel and the staff is mostly helpful…
413. Mark Inn Hotel Deira," 4,262",104,"is purely family oriented with no amenities like SPA or Disco. The food quality is good, the breakfast is good with good choices. 

It is located in the whole…"
414. New Royal Mark Hotel Apartments," 4,242",19,"plans, and the pickings were slim. Stayed here for a couple of nights, and had to pay “last minute”, weekend prices. That would not be so bad, if the rooms weren’t..."
415. J5 Hotels Bur Dubai," 7,115",2,amazing.location  is accessible to city center and metro station.gym and pool is super nice  clean  I would like to say thank you to Arlene who work in the gym she very helpful...
416. 4 Palms Dubai," 21,986",1 review,"time at the hotel, I dont know why but the staff at the hotel not friendly, but mind you so was all the people in Dubai, very agressive, My rooms where very clean, and..."
417. Millennium Place Mirdif Apartments," 12,156",2,"from the General Manager Mr.Bassam to everyone in the Hotel ,Housekeeping Manager Arpana and her team mate Binod-Shivraj.
They are so helpful and care about your..."
418. Boulevard City Suites Hotel Apartments," 7,445",8,"time there is the same feeling of comfort and quietness , the executive suites are very nice on the 11th floor , the pool and sauna are nice , free parking and can…"
419. President Hotel," 9,665",109,"near to indian resturants and metro 
hotel is average 
room ok
bathrooms very bad
bathroom ceiling leaking 
not happy or satisfied with my stay 
can find..."
420. Brand New Boys Hostel Dubai," 1,455",1 review,
421. Al Khoory Executive Hotel," 6,846","1,096",Excellent food 5star Service 5star stay was very pleasant there coriander very helpful saved lot
422. Address Grand Creek Harbour," 31,516",87,experience as a couple and we are glad that we have made our reservation at Address. The staff of the hotel are amiable and responsive to our queries and requests...
423. Canopy by Hilton Dubai Al Seef," 11,364",731,... of Ms. Gelli who helped us to check in and did everything in her ability to provide
424. Ramada Plaza by Wyndham Dubai Deira," 8,866","1,260",Great location ( less than 5 minutes
425. Millennium Place Mirdif," 10,964",371,"""Affordable price, excellent location Everything was great at this hotel.. amazing staff specially bishnu ,,he is friendly"
426. Al Khoory Hotel Apartments," 7,296",653,"Great Location center hub for activities WiFi, facilities"
427. J5 Hotels - Port Saeed," 7,020","1,643",Best hotel with best facilities... Very kind and friendly staff... Full of joy thank
428. Golden Tulip Media Hotel," 8,153",396,"Since we had missed dinner, the staff made sure we didn't go to bed hungry"
429. Premier Inn Dubai Silicon Oasis Hotel," 5,193","2,529",Great value for
430. Flora Al Barsha Hotel At The Mall," 6,362","1,555",Very nice
431. Swissotel Al Ghurair Hotel," 10,261","3,091",Hotel has excellent
432. Downtown Al Bahar Apartments," 75,522",13,"Sheets dirty. Fittings and furniture old and disgusting. Bathrooms were like zero stars, looked like it was from the 60s. Cupboards were damp and disgusting. Stains on..."
433. ibis One Central Hotel," 10,911","1,666",Great hotel nice location with nice view .Room
434. Carlton Tower Hotel Dubai," 9,948",432,Perfect place to stay! Everything about this hotel
435. Byblos Hotel," 8,535",374,"to metro, malls and supermarkets. Definitely recommend this hotel. To receptionist who assisted me, thank you so much for the kind treatment ana and qamar. They have..."
436. Novotel Jumeirah Village Triangle," 9,693",181,Amazing service
437. Tulip Hotel Apartments," 6,025",277,"location in Bur Dubai which is convenient for Indians, close to the BurJuman mall and also 20 min from the airport. The rooms given were also good in terms of space…"
438. Excelsior Hotel Downtown Dubai," 4,846",715,... doing the necessary arrangements for my frnds birthday including late checkout and all assistance god bless
439. Landmark Hotel Baniyas," 3,686",197,diffrent room saying hotel is full as i entered the room it was good but the  washroom was in horrible condition dirty and too small shower broken and stinky i called...
440. Sonder Business Bay," 13,780",28,however the balcony was smaller compared to the 2bedroom apartment.
441. Fortune Deira Hotel," 3,729",110,"location of Dubai. You can enjoy the hustle and bustle of people's day to day lives, and also take in the serene beauty of Dubai Creek not very far from the hotel. The…"
442. Lotus Grand Hotel," 5,323",42,
443. Smana Hotel Al Raffa," 3,527",141,Thank you for
444. Maisan Hotel," 5,898",41,"Expo. 

Very good customer service security guard reception and restaurant thank you to Ahmed and Serafim for welcoming us. 

Breakfast was nice but only ala..."
445. Royal Tulip Hotel," 5,994",65,"prepayment by card went well. The room was clean and comfortable. Some middle-sized shops and restaurants/cafés are nearby. The WiFi worked fine.

Due to the lack of…"
446. Saffron Hotel," 4,001",113,"reception by Mr. Smith and Ms. Lissa.
The housekeeping staff was also kind and helpful.
The engineering staff was in his own world, He  never even listened to my concern..."
447. Hotel Florida International," 7,684",26,"we wanted some cold drinks. 

We show this restaurant and went in, I must say customer service was really good here. We only had some cold drinks tho. 
Staff were..."
448. DAMAC Maison Cour Jardin," 11,641",818,"nice, everything you imagine you can found it in your room especially the kitchen , also the view is awesome, Staff here are very nice people ( Tirtha, Jiniah, Ali, Ch..."
449. Pearl Swiss Hotel," 4,055",10,"could be cleaner, especially the windows and the mirror, but bedsheets were clean)."
450. Orchid Hotel," 7,725",115,staff was cooperative. Good massage center at the 7th floor. Many entertainment clubs are on the mezzanine floor. Near to Dubai metro station. Bit expensive as…
451. Ascott Park Place Dubai," 31,982",613,had an amazing skyline view of sheikh zayed road.
452. Somewhere Apartment Hotel," 25,625",289,Ideal location and
"453. La Ville Hotel & Suites CITY WALK Dubai, Autograph Collection"," 28,096",518,"Thanks to all of the front desk staff for making us feel welcome in our stay, and our housekeeper John for always"
454. Royal Club Palm Jumeirah," 31,916",71,"smelling nice, aircon malfunction, and it was immediately changed. good view. Sun at the pool from around 11:30. The morning buffet was very nice. A fairly good deal..."
455. Five Jumeirah Village Dubai," 12,311","4,102",Team in concierge service was really so helpful and amazing specially Ajinkya was really super friendly and make our family stay wonderful
456. Al Jaddaf Rotana Suite Hotel," 16,313",565,are magnificent timo restaurant wow dishes there fantastic service as well staff very kind and helpful especial thanks for Salem from reception as he was very passio...
457. Studio One Hotel," 9,597",713,Wow it’s amazing hotel I love all the staff at reception divine Younes Hnin eky Mohamed are so amazing and friendly upon
458. Donatello Hotel," 13,303",657,surest is a great buttress at the sevices in the restaurant and also we love enjoy our trip here in Dubai thanks for letting me know this place my friend vicky
"459. Park Apartments Dubai, an Edge by Rotana Hotel"," 13,316",370,They upgraded
460. Studio M  Al Barsha," 5,828",252,Had a wonderful stay The staff is so helpful and cooperative The room is spacious Parking is also available Good restaurants around Walking distance to Mall of the
461. Arjaan - Dubai Media City," 16,715","1,325","I can’t describe how much the staff are amazing, and so friendly"
462. MD Hotel," 8,212",857,"literally everything was amazing… I was seeing the great  from other guests and the rating was high always and was kind of suspecting it, but literally it worths"
463. Edge Creekside Hotel," 7,460",247,"Good hotel, good staff, delicious food, near good shop food and clothes, good climate control in hotel, 10 minutes"
464. Aloft Dubai Airport," 6,390",217,I had very friendly service
465. Chelsea Plaza Hotel," 5,157",453,"He took care of my every need from slippers, phone charger"
466. Signature 1 Hotel Barsha Heights," 7,003",363,Hello  I would love to share my experience highly recommend this
467. S19 Hotel-AL Jaddaf," 9,395",8,
468. Moscow Hotel," 8,318",216,"is , when u sit in lobby at night especially, the security guy irritates ppl and stressed them to leave the lobby and go to your rooms which is the worst behaviour..."
469. Rose Garden Hotel Apartments," 5,941",371,A small pool for a quick dip Good
470. Aloft Dubai South," 5,283",59,it was the best experience
471. Sitara Hotel Apartment," 9,755",3,my family -- it was a fabulous experience for me. I enjoyed every bit in Sitara and always felt at home. Each and every member of their staff treats you with utmost...
472. Baity Hotel Apartments," 6,726",58,"clean rooms good service , good breakfast well equipped pool and gymnasium. best parking , lot of space and , family friendly, 1 bhk and 2 bhk apartments and kitchen."
473. West Zone Plaza Hotel Apartments," 9,803",678,"washing machine 
Refrigerator
Stove
Microwave
Toaster
Kettle 
Utensils
Iron with iron stand
Clothes drying stand
Balconies with some rooms with outdoor..."
474. Akas-Inn Hotel Apartment," 4,349",177,originally supposed to be going to Abu Dhabi but due to restriction changes headed to Dubai instead. We arrived at around 3:30am and the staff were helpful loading our...
475. Phoenicia Hotel," 5,772",28,average and small but clean. Booked this for a stopover from a business trip as I need to freshen up and prepare for another meeting nearby. Good thing the locations is...
476. LEGOLAND Hotel - Dubai," 31,355",5,"every bit of the hotel specially the exciting activities planned during the day, meeting different Lego characters and the waterpark. We just hope that the…"
477. Bed Space For Females Near Metro Station," 2,090",1 review,"Flat.

30 sec Walking Distance from Burjuman metro station.

Neat and Clean.

Upper bed  available
Lower bed available 
Single Bed  Available 
Come first..."
478. Al Marsa," 4,830",2,"did not drain from the sink.  There is no bedside table.  The view is nice, but the rooms are very loud, from the sounds of traffic filtering in. Strange smells in..."
479. Florida Hotel Dubai," 6,957",11,"is located in the area of lots of businesses. If you are in Deira city for a business, you can try this hotel. Most guests are from Africa, and their staff are aware..."
480. Grand Sina Hotel," 5,477",15,"more insects are there. Ok to stay as bachelors. Located right behind sabkha bus station, easy accessibility to metro, taxi's, near by airport etc. Little noisy..."
511. Rose Garden Hotel Apartments – Al Barsha," 20,482",354,"great, the breakfast is nice and the rooms are clean, you can also have a kitchen which is ideal for longer stays. The staff are also very friendly and helpful."
512. Park Inn by Radisson Dubai Motor City," 9,629",695,"at the rooftop overlooking to Dubai autodrome race track, breakfast was good and the reception team are all good and flexible, thanks to Ibrahim for offering excel..."
513. Aparthotel Adagio Premium Dubai Al Barsha," 9,823",874,room service
514. City Seasons Suites," 13,048",94,Everything went well from the quick
515. Fortune Grand Hotel," 5,515",352,worthy it and the staff and service were all good!
516. Xclusive Hotel Apartments," 6,671",521,"Near to Karama, Easy to reach and traval dubai, 
Neat Room service Thanks to Mr. Sohan.
Faced a water issue taken 5 days time to resolve and address it, is that…"
517. Monaco Hotel," 23,165",47,"equipment, but good enough for a short stay. 
As a four star hotel it has everything you need and it is clean, balcony available… However need guest services to be…"
518. TIME Asma Hotel," 7,574",65,He is like a walking
519. Rolla Residence," 6,011",178,"facility etc., Food quality is standard and quick service."
520. Astoria Hotel," 4,182",217,service is good. breakfast is ok. location is perfect. shopping is all walkable. metro stations walkable. cabs easily available. veg and many restaurant options...
521. Mena ApartHotel Al Barsha," 7,443",158,"hospitality provided was awesome. Thanks to Mr. Syed who make the trip memorible with this  friendly behavior and assistance. Nice aparthotel ho cost with family. 

Thanks..."
522. Landmark Hotel Riqqa," 4,965",339,Location is perfect. Very convenient to walk to nearby restaurants. Room service can improve. Needs many reminders for a request. Room has kettle for in room tea prep
523. Landmark Summit Hotel," 4,038",197,"though some issues on room staff's are helpful and there to fixed immidiately., specially Ms. Hena from reception shes attentive and accomodating..the"
524. Al Khaleej Palace Deira Hotel," 3,577",87,Thank you for all staff really the hotel very
525. Panorama Deira Hotel," 3,059",145,"stayed in this hotel for 9 nights from 18 August to 27 August.

Great location nearby union metro. Cheap restaurants are throw away distance. There are many grocery..."
526. Tulip Al Barsha Hotel Apartment," 6,220",29,
527. SKAF Hotels," 11,951",84,hospitable staff .  Only the late hour club music  disturbed my night rest Otherwise the rest was really great and the amenities present as stated on the  trip advisor.
528. Grand Kingsgate Waterfront," 7,111",28,"... you so much for the good hospitality and well behaving staff, They have very nice Executive Room with Living Area, for small family, if you really want"
529. Adagio Jumeirah Village Triangle," 12,011",33,
530. Gulf Oasis Hotel Apartments," 9,956",146,"friendly.He made our stay memorable.
The staff are very helpful & the housekeeping did an amazing job,rooms are clean ,thank's to Vikash who helped us settle in the room..."
531. Better Living Hotel Apartments," 4,631",104,"As for the hotel, check in was fine, rooms are clean, but the house keepers should"
532. Home Away Holiday Homes," 8,744",11,
533. Ink Hotel," 11,002",14,Waterfront.
534. Azur Regency," 8,471",4,"apartments...
the workers Rupesh,kishan,sankalpa,sriman,ajay,ganesh are tooo good , they are very polite and respectfull in interacting.
These guys are totally..."
535. Icon Hotel Apartments," 4,495",66,"not too bad for size however poor facility as some of the socket not functional and broken, microwave oven not working we  request a replacement, no information on…"
536. Skylark Hotel Apartments," 11,086",8,"arrival we have been accommodated in a studik with windows  only even in the picture appears that all studio have balcony.
Personnel at reception are professional.
I..."
537. Armada Living Holiday Homes Rental," 9,237",2,serious maintenance. Cockroaches in the kitchen and rooms. Area also not great for families as nothing to do. Room facilities including the furniture are very tired…
538. Sutchi Hotel," 21,953",5,"that I printed. He asked for a colored printed copy of my ID. So, as per his instruction I when to the nearest copy shop which I think 250 meter-walk away from the..."
539. Al Karnak Hotel," 10,457",1 review,"Souq , got Night for 35 US $ , consisting of 5 floors , staff are helpful , room size is ok , many restaurants and cafeterias in surroundings , bed comfortable"
540. Asiana Suites," 9,062",1 review,and was rudely asked for my room number outside the hotel by the security as if I was of a questionable character. Once inside I complained to the manager and he and...
541. Golden Sands Hotel Creek," 13,733",139,"We felt the difference from the entry point at Reception, Warm welcome, supporting smiling staff, beautiful clean & quiet"
542. Cosmopolitan Hotel," 19,804","2,173","so many different choices and they were all tasty,Ramadan Vibes, The service was great and the waiters were very respectful I recommend it strongly to visit?"
543. Arabian Dreams Hotel Apartments," 16,715",369,
544. Deira Suites Hotel Apartment," 16,196",57,"and big hall, very clean, comfortable , the kitchen is big with all required dishes and appliances. Reception was very helpful,  location of the hotel is great and..."
545. Citadines Culture Village Dubai," 8,598",64,Perfect place to stay! Everything about this hotel
546. Hues Boutique Hotel," 5,212",484,", but the service isn’t good at all the food was good 
Internet access was down for hours and it prevented me from doing my work so I was dissatisfied with it"
547. Rose Executive Hotel DWTC," 9,177",45,... there very welcomed and cheerful specially SHAHUL he was very helpful he manage to
548. City Stay Prime Hotel Apartment," 8,740",68,"My family and i stayed last week and everything was so amazing, the room is so big and clean, the kitchen is well equipped"
549. Pearl City Suites," 11,301",265,"hour for our room to be available. And when it was given to us, the floor is still wet. There is barely an AC. There are flies inside the rooms. The wifi is almost…"
550. Landmark Premier Hotel," 4,484",25,"also well mannered. The staff Abin thomas at the reception had a friendly approach and helped us throughout the stay.
Good hotel for a short stay for this rate."
551. Samaya Hotel Deira," 6,426",249,"stay at the Cornish. Few meter to the gulf and you can take a very cheep boat  to the old town (less than one dollar)
The hotel is clean, calm and well arranged
Be..."
552. Al Jawhara Hotel Apartment," 6,588",52,family trip very happy and really we will come back Again witll recommend friends and family and breakfast was good and staff also friendly and check in was smoothly and...
